{
  "contract_registry_digest": "sha256:0000000000000000000000000000000000000000000000000000000000000000",
  "evidence_plan_digest": "sha256:0000000000000000000000000000000000000000000000000000000000000000",
  "gate_test_manifest_digest": "sha256:0000000000000000000000000000000000000000000000000000000000000000",
  "identity_id": "policy-1",
  "pilot_pack_digest": "sha256:0000000000000000000000000000000000000000000000000000000000000000",
  "pinned_v03_release_digest": "sha256:0000000000000000000000000000000000000000000000000000000000000000",
  "policy_digest": "sha256:0000000000000000000000000000000000000000000000000000000000000000",
  "project_policy_digest": "sha256:0000000000000000000000000000000000000000000000000000000000000000",
  "schema_version": 1
}
